{
  "schemaVersion": "1.0.0",
  "jobId": "job_mock_0001",
  "idempotencyKey": "idem_mock_slice_request_0001",
  "state": "SUCCEEDED",
  "progress": {
    "ratio": 1,
    "stage": "complete",
    "message": "Manifest ready"
  },
  "createdAt": "2026-08-12T10:00:05Z",
  "updatedAt": "2026-08-12T10:00:18Z",
  "startedAt": "2026-08-12T10:00:06Z",
  "finishedAt": "2026-08-12T10:00:18Z",
  "cancelRequested": false,
  "manifestId": "manifest_mock_0001",
  "eventCount": 9
}
