{
  "schemaVersion": "1.0.0",
  "jobId": "job_mock_0001",
  "idempotencyKey": "idem_mock_slice_request_0001",
  "state": "RENDERING",
  "progress": {
    "ratio": 0.55,
    "stage": "render_passes",
    "message": "Rendering editable passes"
  },
  "createdAt": "2026-08-12T10:00:05Z",
  "updatedAt": "2026-08-12T10:00:12Z",
  "startedAt": "2026-08-12T10:00:06Z",
  "cancelRequested": false,
  "eventCount": 5
}
